{
  "schema_version": "1.0.0",
  "state_revision": 2,
  "project_id": "OPN-ORACLE",
  "sequences": {
    "task": 41,
    "activity": 43
  },
  "settings": {
    "allowed_statuses": [
      "pending",
      "in_progress",
      "blocked",
      "done"
    ],
    "allowed_priorities": [
      "low",
      "medium",
      "high",
      "critical"
    ]
  },
  "tasks": [
    {
      "id": "ORC-MOD-001",
      "title": "Gobernanza y arquitectura",
      "description": "Fuente estructurada de planificación, documentación, decisiones, evidencias y contexto entre sesiones.",
      "objective": "Alta para continuar el desarrollo; requiere disciplina de actualización.",
      "status": "done",
      "priority": "medium",
      "parent_id": null,
      "children": [
        {
          "id": "ORC-GOV-001",
          "title": "Sistema vivo de planificación y desarrollo",
          "description": "Roadmap JSON, registros documentales, validador, generador y dashboard HTML autónomo para dirigir el desarrollo entre sesiones.",
          "objective": "Aumentar la trazabilidad y reducir el trabajo perdido entre sesiones.",
          "status": "done",
          "priority": "critical",
          "parent_id": "ORC-MOD-001",
          "children": [],
          "dependencies": [],
          "acceptance_criteria": [
            {
              "text": "{'id': 'AC-1', 'text': 'La fuente principal es oracle-roadmap.json y el dashboard se genera desde ella.', 'status': 'met'}",
              "met": true
            },
            {
              "text": "{'id': 'AC-2', 'text': 'El generador detecta IDs duplicados, dependencias inexistentes, estados inválidos y evidencias ausentes.', 'status': 'met'}",
              "met": true
            },
            {
              "text": "{'id': 'AC-3', 'text': 'El HTML autónomo incluye resumen, checklist filtrable, grafo, arquitectura, decisiones, historial y próximo trabajo.', 'status': 'met'}",
              "met": true
            },
            {
              "text": "{'id': 'AC-4', 'text': 'Una entrada inválida no sobrescribe el HTML existente.', 'status': 'met'}",
              "met": true
            }
          ],
          "comments": [
            {
              "text": "Primera entrega de gobernanza. No implica que las funcionalidades de negocio estén completadas.",
              "author": "migración",
              "created_at": "2026-08-01T09:32:52+00:00"
            }
          ],
          "evidence": [
            {
              "type": "file",
              "path": "scripts/generate-development-dashboard.py",
              "claim": "Valida y genera el artefacto autónomo.",
              "confidence": "high"
            },
            {
              "type": "test",
              "path": "scripts/generate-development-dashboard.py",
              "claim": "La comprobación --check se ejecuta contra el roadmap inicial.",
              "confidence": "high"
            },
            {
              "type": "file",
              "path": "docs/development/oracle-development-dashboard.html",
              "claim": "Dashboard generado con las pestañas requeridas.",
              "confidence": "high"
            }
          ],
          "related_files": [
            "scripts/generate-development-dashboard.py",
            "docs/development/oracle-roadmap.json",
            "docs/development/oracle-development-dashboard.html",
            "docs/development/oracle-decisions.md",
            "docs/development/oracle-progress.md",
            "docs/development/oracle-architecture.md"
          ],
          "tests": [
            {
              "command": "command: python3 scripts/generate-development-dashboard.py --check",
              "result": "passed"
            }
          ],
          "prompt_records": [],
          "blocked_reason": null,
          "completion_override": null,
          "created_at": "2026-07-31",
          "updated_at": "2026-07-31",
          "completed_at": "2026-07-31"
        },
        {
          "id": "ORC-GOV-002",
          "title": "Retirada controlada del prototipo Horizon",
          "description": "Migrar las rutas de Vector a la aplicación autenticada y retirar concept-b solo cuando existan pruebas que protejan la transición.",
          "objective": "Concentrar inversión y reducir divergencia UX.",
          "status": "pending",
          "priority": "medium",
          "parent_id": "ORC-MOD-001",
          "children": [],
          "dependencies": [
            "ORC-UX-002",
            "ORC-UX-003"
          ],
          "acceptance_criteria": [
            {
              "text": "{'id': 'AC-1', 'text': 'Vector cubre las rutas productivas autenticadas sin depender de concept-b.', 'status': 'pending'}",
              "met": false
            },
            {
              "text": "{'id': 'AC-2', 'text': 'Existe una decisión explícita de archivo o borrado y una suite que evita regresiones.', 'status': 'pending'}",
              "met": false
            }
          ],
          "comments": [
            {
              "text": "Se mantiene diferido por seguridad de cambio y porque no forma parte de la primera ejecución.",
              "author": "migración",
              "created_at": "2026-08-01T09:32:52+00:00"
            }
          ],
          "evidence": [
            {
              "type": "file",
              "path": "docs/architecture/REPOSITORY_MAP.md",
              "claim": "Documenta concept-b como prototipo no canónico.",
              "confidence": "high"
            }
          ],
          "related_files": [
            "src/app/concept-b/page.tsx",
            "src/app/app/layout.tsx",
            "docs/UI_DECISION_GUIDE.md"
          ],
          "tests": [
            {
              "command": "src/lib/app-routes.test.ts",
              "result": null
            },
            {
              "command": "tests/e2e/smoke.spec.ts",
              "result": null
            }
          ],
          "prompt_records": [],
          "blocked_reason": null,
          "completion_override": null,
          "created_at": "2026-07-31",
          "updated_at": "2026-07-31",
          "completed_at": null
        }
      ],
      "dependencies": [],
      "acceptance_criteria": [],
      "comments": [],
      "evidence": [],
      "related_files": [],
      "tests": [],
      "prompt_records": [],
      "blocked_reason": null,
      "completion_override": null,
      "created_at": "2026-08-01T09:32:52+00:00",
      "updated_at": "2026-08-01T09:32:52+00:00",
      "completed_at": "2026-08-01T09:32:52+00:00"
    },
    {
      "id": "ORC-MOD-002",
      "title": "Plataforma, identidad y seguridad",
      "description": "Fundación Flask, tenant context, sesiones, CSRF, RBAC, auditoría y operación de la plataforma.",
      "objective": "Alta, con gates operativos y de seguridad pendientes de mantener en cada release.",
      "status": "in_progress",
      "priority": "medium",
      "parent_id": null,
      "children": [
        {
          "id": "ORC-PLAT-001",
          "title": "Fundación Flask, OpenAPI y health checks",
          "description": "Application factory, configuración tipada, extensiones desacopladas, contrato OpenAPI, errores y endpoints de salud.",
          "objective": "Reducir riesgo de integración y hacer reproducible el backend.",
          "status": "done",
          "priority": "critical",
          "parent_id": "ORC-MOD-002",
          "children": [],
          "dependencies": [],
          "acceptance_criteria": [
            {
              "text": "{'id': 'AC-1', 'text': 'La aplicación se crea mediante create_app y registra módulos sin lógica de negocio en Node.', 'status': 'met'}",
              "met": true
            },
            {
              "text": "{'id': 'AC-2', 'text': 'El contrato OpenAPI se exporta de forma reproducible bajo /api/v1.', 'status': 'met'}",
              "met": true
            },
            {
              "text": "{'id': 'AC-3', 'text': 'Existen probes live/ready y errores problem+json.', 'status': 'met'}",
              "met": true
            }
          ],
          "comments": [
            {
              "text": "La documentación histórica de repository map necesita una actualización posterior para reflejar la superficie /app actual.",
              "author": "migración",
              "created_at": "2026-08-01T09:32:52+00:00"
            }
          ],
          "evidence": [
            {
              "type": "file",
              "path": "apps/api/src/opn_oracle/app.py",
              "claim": "Application factory y registro de módulos.",
              "confidence": "high"
            },
            {
              "type": "test",
              "path": "apps/api/tests/test_contract.py",
              "claim": "Contrato HTTP/OpenAPI cubierto.",
              "confidence": "high"
            },
            {
              "type": "file",
              "path": "docs/api/openapi.json",
              "claim": "Artefacto OpenAPI versionado.",
              "confidence": "high"
            }
          ],
          "related_files": [
            "apps/api/src/opn_oracle/app.py",
            "apps/api/src/opn_oracle/config.py",
            "apps/api/src/opn_oracle/extensions.py",
            "apps/api/src/opn_oracle/common/openapi.py",
            "apps/api/src/opn_oracle/api/health.py",
            "docs/api/openapi.json"
          ],
          "tests": [
            {
              "command": "apps/api/tests/test_app.py",
              "result": "passed"
            },
            {
              "command": "apps/api/tests/test_health.py",
              "result": "passed"
            },
            {
              "command": "apps/api/tests/test_contract.py",
              "result": "passed"
            }
          ],
          "prompt_records": [],
          "blocked_reason": null,
          "completion_override": null,
          "created_at": "2026-07-31",